link_id,post_id,month,title,post_author,post_flair,comments,unique_authors,reply_comments,comments_per_author,reply_ratio
t3_eh3o63,eh3o63,2019-12,Lebanon 60 years ago,[deleted],Unflaired/Unknown,40,2,38,20.0,0.95
t3_ev0xmb,ev0xmb,2020-01,Arab and Israeli duet (in Arabic and Hebrew),c9joe,Israeli,70,6,66,11.667,0.943
t3_pm49br,pm49br,2021-09,Ban speedrun attempt number 1,[deleted],Unflaired/Unknown,195,17,191,11.471,0.979
t3_j5vb6a,j5vb6a,2020-10,Is it legal to talk to someone living in Europe who has Lebanese passport?,[deleted],Unflaired/Unknown,43,5,38,8.6,0.884
t3_1fl0vm5,1fl0vm5,2024-09,This sub aware of Maronite’s spreading blood libel throughout the region ,Exciting_Wrangler_31,Unflaired/Unknown,51,6,48,8.5,0.941
t3_1otbyc4,1otbyc4,2025-11,Salam: My generation and I made mistakes in the past.,pornchavo,Unflaired/Unknown,91,11,87,8.273,0.956
t3_ew8svr,ew8svr,2020-01,Qannoubine Valley of the Saints,[deleted],Unflaired/Unknown,22,3,20,7.333,0.909
t3_j3kp5q,j3kp5q,2020-10,Everyone in this is a traitor,Jolly_Independence69,Unflaired/Unknown,115,16,102,7.188,0.887
t3_vrx4le,vrx4le,2022-07,so how do you guys justify israel violating lebanese airspace every week almost,Lil_jayye,Unflaired/Unknown,192,27,177,7.111,0.922
t3_n9uno7,n9uno7,2021-05,The terror of Israel,ANAS-SH,Unflaired/Unknown,28,4,25,7.0,0.893
t3_i3ph6w,i3ph6w,2020-08,Beirut Explosion Updates/News Thread,cha3bghachim,Lebanese,94,14,57,6.714,0.606
t3_18b8z4y,18b8z4y,2023-12,Israeli Christian-Lebanese gives a speech at a pro Israel rally in Canada,traumaking4eva,Unflaired/Unknown,100,15,92,6.667,0.92
t3_irxm1d,irxm1d,2020-09,How do you all feel that the Balad party in Israel has a summer camp for kids?,[deleted],Unflaired/Unknown,60,9,55,6.667,0.917
t3_p29iwd,p29iwd,2021-08,Imagine loving israel niggas.You are literally betraying the people that died in 2000 and 2006 forgetting israeli war crimes and supporting war crimes agaist arabs and even jewsih mistreated people.I am ashamed by this sub reddit.And its creator.I hope you all get a piece of justice.Goodbye fuckers.,Carlos_The_Roach,Unflaired/Unknown,117,18,107,6.5,0.915
t3_hijy5r,hijy5r,2020-06,Secular visions need to win over Shi'a // A post by a secular Shi'ite,zbatouik,Unflaired/Unknown,52,8,45,6.5,0.865
t3_1e6ptjt,1e6ptjt,2024-07,Do you think Israel will be any kinder to Lebanon?,Narrow_Pumpkin5948,Unflaired/Unknown,52,8,49,6.5,0.942
t3_1hagn59,1hagn59,2024-12,Congratulations to my Israeli neighbors ,price_of_sleep,Unflaired/Unknown,71,11,62,6.455,0.873
t3_gm2rgf,gm2rgf,2020-05,"Have any of you Lebanese bros seen the film ""The Insult""? I was wondering if any of you can explain the context.",briskt,Diaspora Jew,45,7,43,6.429,0.956
t3_ngc3o2,ngc3o2,2021-05,STOP ACTING LIKE THE VICTIM !!!!!,BreakYourAnkles,Unflaired/Unknown,32,5,29,6.4,0.906
t3_i1cbqr,i1cbqr,2020-07,Visibility of Israel’s Borders from Space #4,IbnEzra613,Diaspora Jew,31,5,28,6.2,0.903
t3_dzhae7,dzhae7,2019-11,Why are Lebanese more progressive than other Arabs?,[deleted],Unflaired/Unknown,43,7,38,6.143,0.884
t3_irggf9,irggf9,2020-09,"I'd like to have a discussion about Raja Za'atara, an Arab who was elected to be Deputy Mayor of Haifa, but was forced to resign due to his beliefs on the Syrian government, Hezbollah, Hamas, and the foundation of the state of Israel.",[deleted],Unflaired/Unknown,24,4,21,6.0,0.875
t3_h0i1g3,h0i1g3,2020-06,IDF honors South Lebanon Army with ceremony marking 20 years since withdrawal,Small_Watch,Israeli,57,10,52,5.7,0.912
t3_1gdkxtg,1gdkxtg,2024-10,Hope the lebanese army will open eyes on social media,LinusSmackTips,Israeli,57,10,51,5.7,0.895
t3_hjr165,hjr165,2020-07,What it's like right now in Lebanon?,Shachar2like,Unflaired/Unknown,28,5,26,5.6,0.929
t3_xtg1c0,xtg1c0,2022-10,How Moslems always act,Medical-Bowl2194,Unflaired/Unknown,28,5,25,5.6,0.893
t3_1g3j50t,1g3j50t,2024-10,Today ,DifficultLadder7638,Unflaired/Unknown,106,19,98,5.579,0.925
t3_1gglcaw,1gglcaw,2024-10,Anyone know the validity of this??,DrVeigonX,Israeli,55,10,51,5.5,0.927
t3_rxpmtu,rxpmtu,2022-01,Lebanon the victorious and Israel the defeated,Shachar2like,Unflaired/Unknown,16,3,15,5.333,0.938
t3_17kasek,17kasek,2023-10,I have a question for the Lebanese people who know anything about the 1982 war,soontobemine,Unflaired/Unknown,16,3,12,5.333,0.75
t3_1gu6n3f,1gu6n3f,2024-11,"IDF: Hezbollah Underground Terrorist Infrastructure Containing Dozens of Launchers, Rockets, and Weapons, Uncovered in Southern Lebanon - 18 November 2024",Shachar2like,Unflaired/Unknown,16,3,15,5.333,0.938
t3_1bw300c,1bw300c,2024-04,Letter to moderate Muslims of the world,ActiveCarpet1040,Unflaired/Unknown,120,23,109,5.217,0.908
t3_hzivp5,hzivp5,2020-07,"With Lebanon in virus lockdown, Hezbollah can’t afford an Israel flare-up — yet",t-vishni,Diaspora Israeli,26,5,23,5.2,0.885
t3_g8byea,g8byea,2020-04,Genuine question: how are lebanese supposed to ever one day have peace with Israel?,Nader_OwO,Lebanese,139,27,121,5.148,0.871
t3_e9ts99,e9ts99,2019-12,Do all Israeli Jews have the same traditions/culture/political alignment ?,[deleted],Unflaired/Unknown,36,7,32,5.143,0.889
t3_niwvqe,niwvqe,2021-05,"A question to the Lebanese people, what do you think of unity based on shared history?",ForAnat,Unflaired/Unknown,46,9,41,5.111,0.891
t3_175vrf9,175vrf9,2023-10,Only Peace Achieves its Goals,Mediocritish,Unflaired/Unknown,46,9,41,5.111,0.891
t3_1dmgyr4,1dmgyr4,2024-06,The Palestinians,Long-Round2151,Unflaired/Unknown,143,28,134,5.107,0.937
t3_erweru,erweru,2020-01,What are the main differences between Lebanese and Syrians?,[deleted],Unflaired/Unknown,51,10,40,5.1,0.784
t3_1aymxjb,1aymxjb,2024-02,“Forbidden Bromance”,High_Order47,Unflaired/Unknown,66,13,59,5.077,0.894
t3_1foohie,1foohie,2024-09,Why are there still Lebanese people in this sub?,Level-Interview-5512,Unflaired/Unknown,70,14,62,5.0,0.886
t3_ewm11k,ewm11k,2020-01,Middle eastern VS Mediterranean Culture,[deleted],Unflaired/Unknown,60,12,53,5.0,0.883
t3_s0inxj,s0inxj,2022-01,The other (ugly) face of Lebanon,Shachar2like,Unflaired/Unknown,40,8,38,5.0,0.95
t3_17wn85b,17wn85b,2023-11,Hunting,orie415,Unflaired/Unknown,25,5,23,5.0,0.92
t3_ew1mhy,ew1mhy,2020-01,"Visibility was so good last weekend, you could see from Beirut to Damascus (credit in the comments)",Real_Talink,Israeli,20,4,18,5.0,0.9
t3_1cf7oje,1cf7oje,2024-04,Strange question -Jammed GPS,Tagglit2022,Israeli,20,4,17,5.0,0.85
t3_ee773u,ee773u,2019-12,Are there unique Christmas traditions in Lebanon? Any special Holiday recipes?,[deleted],Unflaired/Unknown,10,2,8,5.0,0.8
t3_1j6hl8f,1j6hl8f,2025-03,This needs to stop,LebnaniandProud,Unflaired/Unknown,89,18,79,4.944,0.888
t3_s1jt9g,s1jt9g,2022-01,We have no problems with our jew brothers.,Offica_Makenzi,Unflaired/Unknown,74,15,65,4.933,0.878
t3_17ebxoc,17ebxoc,2023-10,"For Lebanese members here, what are your current views on Israel as the war progresses?",emaxwell13131313,Unflaired/Unknown,39,8,32,4.875,0.821
t3_srn826,srn826,2022-02,Can we please ban u/segevazulaifanboyo?,[deleted],Unflaired/Unknown,34,7,26,4.857,0.765
t3_jm0hso,jm0hso,2020-11,What are the best sources for Israeli news/politics from a far-left/left perspective?,[deleted],Unflaired/Unknown,29,6,26,4.833,0.897
t3_1cqgqr3,1cqgqr3,2024-05,Next Wednesday 15th May is Nakba Day and it is the 5th year Combatants for Peace is hosting the Joint Nakba Remembrance Ceremony.,Geoffrey_Cohen,Unflaired/Unknown,29,6,27,4.833,0.931
t3_1exnuyu,1exnuyu,2024-08,What do you think about this narrative about the history of Christian Lebanon?,Infinite_Lettuce_105,Israeli,67,14,62,4.786,0.925
t3_1jcigbm,1jcigbm,2025-03,A corrupt Lebanon can never normalize with Israel,victoryismind,Lebanese,81,17,67,4.765,0.827
t3_1d4xge9,1d4xge9,2024-05,Excusing the crimes of the Phalangists ,JellyfishHot1635,Unflaired/Unknown,19,4,17,4.75,0.895
t3_1frkwku,1frkwku,2024-09,"This was removed on the main sub but I stand by what I said . You both behave the same in many aspects.  ""Israeli and Lebanese Jewish and Shia often don’t realize or admit how similar they really are""",EreshkigalKish2,Unflaired/Unknown,52,11,46,4.727,0.885
t3_106yiwh,106yiwh,2023-01,This made me tear up,xdecayedghoulx,Unflaired/Unknown,33,7,30,4.714,0.909
t3_1do06mu,1do06mu,2024-06,"From Beirut to Haifa, Let's End This Strife-a!",seek-song,Unflaired/Unknown,61,13,56,4.692,0.918
t3_12o5iu9,12o5iu9,2023-04,Asking my Lebanese Friends - In your opinion what will be the end of Hezbollah?,FaceFuckerDaddy,Unflaired/Unknown,75,16,65,4.688,0.867
t3_i76j3d,i76j3d,2020-08,"the israeli-lebanese war, how can we ever overcome the pain and blood caused?",[deleted],Unflaired/Unknown,56,12,50,4.667,0.893
t3_1o82ck1,1o82ck1,2025-10,Video recommendation: Moto roadtrip in Lebanon,victoryismind,Lebanese,14,3,11,4.667,0.786
t3_i8a6v8,i8a6v8,2020-08,This video is for the idiotic account on /r/lebanon who said that Arabs in Israel don't have any right. What a pure lie.,Aggravating-ADD,Non-Canaanite,102,22,97,4.636,0.951
t3_1h53vzy,1h53vzy,2024-12,Israel is at fault in today’s escalation ,OliveWhisperer,Diaspora Lebanese,69,15,60,4.6,0.87
t3_emhucb,emhucb,2020-01,Israelites and Canaanites,cedaroot,Lebanese,46,10,39,4.6,0.848
t3_1ex7mkr,1ex7mkr,2024-08,"Even if Hezbollah were gone, could there be peace?",memyselfandi12358,Unflaired/Unknown,225,49,208,4.592,0.924
t3_1ayglza,1ayglza,2024-02,P H U C K ISRAEL,Substantial-Pen-6984,Unflaired/Unknown,101,22,91,4.591,0.901
t3_txdduy,txdduy,2022-04,I am looking for Arabs to interact with here on Reddit,Israeliman1245,Israeli,87,19,79,4.579,0.908
t3_1rhs57y,1rhs57y,2026-03,Khameneis dead,Ready-Raise-7480,Unflaired/Unknown,32,7,30,4.571,0.938
t3_1gq7ehe,1gq7ehe,2024-11,How do you think the day after the war would look like?,galieiz,Unflaired/Unknown,105,23,97,4.565,0.924
t3_1h4m814,1h4m814,2024-12,Can Lebanon take control back from Hezbollah?,Pretend-Ad2312,Unflaired/Unknown,82,18,77,4.556,0.939
t3_1h132a3,1h132a3,2024-11,"Head of Syriac Union Party calls Hezbollah ""terrorist"" on live TV and files a suit to try Hezbollah's members for treason",OkWhole8544,Unflaired/Unknown,59,13,53,4.538,0.898
t3_1j1fnfa,1j1fnfa,2025-03,Can someone explain to me why Israel is attacking Syria under pretense of protecting Druze?,CriticalJellyfish207,Unflaired/Unknown,181,40,162,4.525,0.895
t3_1fw3dr8,1fw3dr8,2024-10,Where do you stand on targeting medics?,Public_King7714,Unflaired/Unknown,122,27,105,4.519,0.861
t3_1coons0,1coons0,2024-05,Thoughts?,sacablush,Unflaired/Unknown,45,10,40,4.5,0.889
t3_ndf5yp,ndf5yp,2021-05,"Al-Manar reports that Hezbollah no. 2, Naim Qassem, has visited the heads of Lebanon branches of Hamas and The Islamic Jihad to congratulate them. ""What Palestine needs is Jihad""",IllWolverineeee,Unflaired/Unknown,27,6,25,4.5,0.926
t3_q38om7,q38om7,2021-10,"Hello my name is Soraya I am Lebanese based in Paris, I am currently working on a project between lebanese diaspora and Jewish diaspora that is interested in a respectful dialogue to learn about each other. I am looking for participants to join us and share one’s ideas with us!!",soraya64,Unflaired/Unknown,58,13,50,4.462,0.862
t3_i0pmty,i0pmty,2020-07,"Video: ""The SLA and Gibran Tueni.""",[deleted],Unflaired/Unknown,71,16,64,4.438,0.901
t3_spkxsa,spkxsa,2022-02,[deleted by user],[deleted],Unflaired/Unknown,31,7,26,4.429,0.839
t3_1e3wlr9,1e3wlr9,2024-07,Israel-Palestine posts are off-topic,cha3bghachim,Lebanese,84,19,75,4.421,0.893
t3_1r43oo8,1r43oo8,2026-02,Why are Christians in Lebanon becoming so antisemitic?,Ready-Raise-7480,Unflaired/Unknown,106,24,94,4.417,0.887
t3_ibd6qh,ibd6qh,2020-08,Phoenician Word Of The Day: 𐤔𐤓𐤔,Small_Watch,Israeli,22,5,20,4.4,0.909
t3_s1ksqi,s1ksqi,2022-01,Acts of kindness done by the IOF to our citizens in Lebanon.,Offica_Makenzi,Unflaired/Unknown,35,8,30,4.375,0.857
t3_1g0n9xb,1g0n9xb,2024-10,Join the Forbidden Bromance Discord Server!,victoryismind,Lebanese,35,8,29,4.375,0.829
t3_1irdx4w,1irdx4w,2025-02,I have a Question for the Lebanese people. (I apologise in advance for the Latinisation I tried to remain as consistent as possible and that means I use the widely known Latinised names instead of the original Semetic names),Royakushka,Unflaired/Unknown,35,8,30,4.375,0.857
t3_po75cu,po75cu,2021-09,[deleted by user],[deleted],Unflaired/Unknown,48,11,44,4.364,0.917
t3_pcswxr,pcswxr,2021-08,Marhaba and shalom. Just a political question for everyone here about which faction you think is most responsible for the current crisis in Lebanon.,[deleted],Unflaired/Unknown,74,17,64,4.353,0.865
t3_1g0cqls,1g0cqls,2024-10,What do you think and endgame for this war should look like?,asafg8,Unflaired/Unknown,65,15,58,4.333,0.892
t3_u656zt,u656zt,2022-04,Hezbollah MP says only $9 billion needed to destroy Israel,verynicesnail,Israeli,52,12,39,4.333,0.75
t3_1j0ur67,1j0ur67,2025-03,The good old times💔,PineappleKey1608,Unflaired/Unknown,52,12,46,4.333,0.885
t3_ejwqkw,ejwqkw,2020-01,Someone quick sacrifice a goat to Ba’al before he kills all of us,[deleted],Unflaired/Unknown,13,3,10,4.333,0.769
t3_f8c04j,f8c04j,2020-02,Isreali alternative music scene,Ringslap,Lebanese,13,3,12,4.333,0.923
t3_1g9hot0,1g9hot0,2024-10,"Peace treaty, normalisation... never in 10452 years. ",Rude_Boy_15,Unflaired/Unknown,13,3,12,4.333,0.923
t3_hc5oyt,hc5oyt,2020-06,July 1 annexation,[deleted],Unflaired/Unknown,43,10,36,4.3,0.837
t3_1dib9dd,1dib9dd,2024-06,Israeli Politician Quotes Hitler to Argue for Resettlement of Gaza | Common Dreams,Finaltryer,Unflaired/Unknown,60,14,49,4.286,0.817
t3_1j5e1mx,1j5e1mx,2025-03,Can someone explain this to me? - Israel raids Palestinian bookstores. Arrests persons selling books.,CriticalJellyfish207,Unflaired/Unknown,77,18,68,4.278,0.883
t3_1gv4y3b,1gv4y3b,2024-11,"My Children: A Thoughtful Rebuttal to the Jerusalem Post Article Titled *""Southern Lebanon is Actually Northern Israel - Opinion""",joeyleq,Unflaired/Unknown,47,11,46,4.273,0.979
t3_1delr2v,1delr2v,2024-06,I don't see lebanese people would want to have a bromance with..this,Finaltryer,Unflaired/Unknown,115,27,101,4.259,0.878
t3_1rm9hnf,1rm9hnf,2026-03,Change my mind : I do not want peace or any relations with Lebanon. ( only non-war),lucks1234,Unflaired/Unknown,149,35,126,4.257,0.846
t3_hmt3a5,hmt3a5,2020-07,If Israel didn't extend the millitary occupation after completing its objectives of eliminating the PLO?,[deleted],Unflaired/Unknown,34,8,29,4.25,0.853
t3_l8nvvu,l8nvvu,2021-01,sup neighbors,natourrr,Unflaired/Unknown,34,8,31,4.25,0.912
t3_1rijfeo,1rijfeo,2026-03,Work experience,Optimal_Speed_361,Unflaired/Unknown,34,8,28,4.25,0.824
t3_1crko2y,1crko2y,2024-05,"Lebanese christians ,I'm posting here bcz I'm banned from the lebanon sub",Impressive_Winner_56,Unflaired/Unknown,106,25,93,4.24,0.877
t3_1dhs2ug,1dhs2ug,2024-06,"Solomon's kingdom
this is the flag of israel
from river to the sea
what's written in psalm 72:8 is much more bigger than this -yet to be achieved",HerbNPaper,Unflaired/Unknown,118,28,103,4.214,0.873
t3_1dnffbf,1dnffbf,2024-06,"Lebanese people can’t control Hizbollah, we don’t deserve to be hit if this war happens ",Antique-Ad-2618,Unflaired/Unknown,257,61,221,4.213,0.86
t3_1b17dfc,1b17dfc,2024-02,Jon Stewart's METO soln,levnon14,Diaspora Lebanese,63,15,55,4.2,0.873
t3_esvm7d,esvm7d,2020-01,Full Interview: Former Lebanon Foreign Minister Gebran Bassil | CNBC International,cha3bghachim,Lebanese,21,5,16,4.2,0.762
t3_1ga68y7,1ga68y7,2024-10,People in Beirut: how’s the nightlife scene handling this situation?,Old_Pilot480,Israeli,21,5,19,4.2,0.905
t3_1oibpti,1oibpti,2025-10,Do you support Lebanese Jews returning to Lebanon?,Far-Building3569,Unflaired/Unknown,21,5,17,4.2,0.81
t3_18cricg,18cricg,2023-12,The obstacle to peace,Deep-Succotash-2194,Unflaired/Unknown,92,22,83,4.182,0.902
t3_1gck0vl,1gck0vl,2024-10,A question for the Lebanese on this sub,L_L1,Unflaired/Unknown,54,13,50,4.154,0.926
t3_gu8cdm,gu8cdm,2020-05,The shitstorm that is lebanon,[deleted],Unflaired/Unknown,37,9,32,4.111,0.865
t3_nyugpi,nyugpi,2021-06,Saw an Arab Israeli (his self-ID) post this about Lebanon. Would you guys agree or is this an oversimplification?,alleeele,Israeli,37,9,30,4.111,0.811
t3_escenm,escenm,2020-01,How popular is annexation of land among the Israeli population ?,cedaroot,Lebanese,82,20,72,4.1,0.878
t3_1fpr5q1,1fpr5q1,2024-09,We are both screwed,62TiredOfLiving,Unflaired/Unknown,82,20,73,4.1,0.89
t3_e6jd7v,e6jd7v,2019-12,What do you think are Lebanon and Israel's demands for reaching a non-belligerence pact between the countries?,[deleted],Unflaired/Unknown,85,21,76,4.048,0.894
t3_nd7u5o,nd7u5o,2021-05,Hey neighbors! How’s the situation near you ? Hopefully everyone is safe 🙏🏻,Apprehensive_Angle91,Unflaired/Unknown,100,25,85,4.0,0.85
t3_18yihmt,18yihmt,2024-01,"Hi y'all, first time poster, to the Lebanese people on the subreddit, I'd like to ask, how do you think the animosity between our countries could be solved?",Special-Key-6578,Unflaired/Unknown,64,16,58,4.0,0.906
t3_1o0ax1x,1o0ax1x,2025-10,"Two years and the war continues, a brutal armed faction and a right-wing extremist government. When will the region live in peace and stability?",daniel_ctaw7,Jordanian,52,13,45,4.0,0.865
t3_10sh23l,10sh23l,2023-02,"""Denying Citizenship to Palestinian Refugees in Lebanon Is an Inhuman Apartheid Policy""",Shachar2like,Unflaired/Unknown,40,10,30,4.0,0.75
t3_1c3ozt1,1c3ozt1,2024-04,Your thoughts on this?,Impressive_Winner_56,Unflaired/Unknown,40,10,36,4.0,0.9
t3_evd70d,evd70d,2020-01,Just found out about this sub.,cieol,Israeli,36,9,32,4.0,0.889
t3_sxs03m,sxs03m,2022-02,Lebanese soldiers quit as economy worsens (3min video report),Shachar2like,Unflaired/Unknown,36,9,32,4.0,0.889
t3_x4p1ek,x4p1ek,2022-09,"Israeli rules say West Bank visitors must declare love interest. Foreigners must tell the Israeli defence ministry if they fall in love with a Palestinian in the occupied West Bank, according to new rules.",victoryismind,Lebanese,36,9,33,4.0,0.917
t3_1red51o,1red51o,2026-02,Israeli ‘liberal’ opposition leader agrees with Mike Huckabee that the bible gives Israel the right to land from Egypt to Iraq,WebFar9897,Unflaired/Unknown,36,9,30,4.0,0.833
t3_1fk2m5w,1fk2m5w,2024-09,Looking for good faith conversation/debate with Lebanese people on the conflict,Commercial_Lie_7240,Unflaired/Unknown,32,8,27,4.0,0.844
t3_q9t8bl,q9t8bl,2021-10,"I usually don't post tweets, but this one spoke to me. Hezbollah, like Hamas, spends gigantic sums of money on rockets, but sucks out the money from Lebanon.",TheKlorg,Unflaired/Unknown,28,7,24,4.0,0.857
t3_ier0ft,ier0ft,2020-08,"In its anti-terrorism efforts, Switzerland to completly ban Hezbollah.",cha3bghachim,Lebanese,20,5,18,4.0,0.9
t3_lktm9g,lktm9g,2021-02,IsRaEL is oNlY 25 yEaRs AwaY fROm BeINg deSTroyEd At MaXIMuM,Omni_bahamut,Diaspora Lebanese,20,5,18,4.0,0.9
t3_erha80,erha80,2020-01,The Safra Dynasty: The Mysterious Family Of The Richest Banker In The World (Jewish Lebanese bankers),[deleted],Unflaired/Unknown,12,3,11,4.0,0.917
t3_satgs9,satgs9,2022-01,[deleted by user],[deleted],Unflaired/Unknown,12,3,10,4.0,0.833
t3_jfta1h,jfta1h,2020-10,Subliminal - The Light and the Shadow,[deleted],Unflaired/Unknown,8,2,7,4.0,0.875
t3_1do787q,1do787q,2024-06,Just to finish the conversation about the beirut airport,allum1na4ed,Unflaired/Unknown,95,24,79,3.958,0.832
t3_1byaaqv,1byaaqv,2024-04,I'm so sick of hezbollah ,Impressive_Winner_56,Unflaired/Unknown,134,34,110,3.941,0.821
t3_1hvvzb5,1hvvzb5,2025-01,Presidency question,Impressive-Rub529,Israeli,39,10,35,3.9,0.897
t3_1lg2jx1,1lg2jx1,2025-06,Why do I have a feeling that Lebanon will become the new Assad regime?,Fast-Budget8977,Unflaired/Unknown,39,10,32,3.9,0.821
t3_1i8rday,1i8rday,2025-01,It Is Time for Israeli-Lebanese Peace,OkWhole8544,Unflaired/Unknown,62,16,58,3.875,0.935
t3_1gu0bd8,1gu0bd8,2024-11,The most revolutionary interview yet By a Lebanese Christian - Imad Sham3oun,Both-Entertainment-3,Israeli,27,7,25,3.857,0.926
t3_1dt5y65,1dt5y65,2024-07,Never forget sabrina and shatila massacre,allum1na4ed,Unflaired/Unknown,46,12,39,3.833,0.848
t3_rwgvpj,rwgvpj,2022-01,I am Jewish I pray for Lebanon 🇱🇧,[deleted],Unflaired/Unknown,23,6,19,3.833,0.826
t3_15jj11m,15jj11m,2023-08,what would lebanon look like if the government and foreign policy was actually representative of its people?,Xirradon,Diaspora Jew,57,15,52,3.8,0.912
t3_1jdx3y9,1jdx3y9,2025-03,I just learned something really ugly about Israel. Netanyahu's government intentionally empowered Hamas.,CriticalJellyfish207,Unflaired/Unknown,57,15,47,3.8,0.825
t3_oiwt9t,oiwt9t,2021-07,Israeli working with lebanese?,Codeinum,Israeli,34,9,29,3.778,0.853
t3_1ogeuvf,1ogeuvf,2025-10,I have a question to my Israeli Druze.,DRZyeg,Unflaired/Unknown,34,9,27,3.778,0.794
t3_1fqkzgy,1fqkzgy,2024-09,My view as an Israeli Druze.,Israelidru,Israeli,30,8,24,3.75,0.8
t3_g9lx82,g9lx82,2020-04,Nearly 600 of us and no formal set of rules yet!,cha3bghachim,Lebanese,15,4,10,3.75,0.667
t3_i5gyqm,i5gyqm,2020-08,Phoenician Word Of The Day: 𐤋𐤁𐤍,Small_Watch,Israeli,15,4,12,3.75,0.8
t3_if2gjq,if2gjq,2020-08,Phoenician Word Of The Day: 𐤌𐤇𐤍𐤕,Small_Watch,Israeli,15,4,13,3.75,0.867
t3_p1pf2g,p1pf2g,2021-08,A bit to aggresive but true,verynicesnail,Israeli,41,11,36,3.727,0.878
t3_kn7jdf,kn7jdf,2020-12,If you Israelies really want peace how come you have been voting for the Likud the most right wing party since 2009?,IRHABI313,Unflaired/Unknown,52,14,46,3.714,0.885
t3_1f3rzn7,1f3rzn7,2024-08,Found a sticker I think we can all agree with,1ntere5t1ng,Unflaired/Unknown,37,10,35,3.7,0.946
t3_1f2bo8x,1f2bo8x,2024-08,Founder of modern Zionism mentions Lebanon in his utopian novel The Old New Land (1902),Ezraah,Unflaired/Unknown,48,13,44,3.692,0.917
t3_i3058g,i3058g,2020-08,What percentage of Israelis would you say have aspirations similar to these guys ? (Notice their envisioned borders of israel).,bcthrowawaya,Unflaired/Unknown,44,12,39,3.667,0.886
t3_1fwnwqy,1fwnwqy,2024-10,Two Nice Guys Having a Civil Conversation,ImpenetrableKiwi,Unflaired/Unknown,33,9,26,3.667,0.788
t3_srla8u,srla8u,2022-02,[deleted by user],[deleted],Unflaired/Unknown,11,3,8,3.667,0.727
t3_nanh48,nanh48,2021-05,For anyone under constant bombing I hope you and your family and friends all stay safe❤❤. Once a fren always a fren. From LebBro,DankDEEZNutz,Unflaired/Unknown,51,14,42,3.643,0.824
t3_jdgqvl,jdgqvl,2020-10,Levantine Arabic dialects in Israel and Lebanon,[deleted],Unflaired/Unknown,29,8,26,3.625,0.897
t3_pn7tv4,pn7tv4,2021-09,[deleted by user],[deleted],Unflaired/Unknown,29,8,24,3.625,0.828
t3_fcesti,fcesti,2020-03,Wasn’t that last person one of the most active members on this sub ? Sad to see that some are being fake and deceiving in their interactions.,moumeet67,Unflaired/Unknown,47,13,42,3.615,0.894
t3_17ppm6s,17ppm6s,2023-11,I'm not doing too well today.,LevantinePlantCult,Unflaired/Unknown,47,13,36,3.615,0.766
t3_kylaq5,kylaq5,2021-01,"Israeli police attack Palestinian Arab protestors, but let Arab criminals wreak havoc on the Israeli Arab community, and look the other way when IDF soldiers sell Arab criminals weapons",[deleted],Unflaired/Unknown,65,18,54,3.611,0.831
t3_e2zl0p,e2zl0p,2019-11,"Dating “the enemy”, Ask me questions!",anonthinker9,Israeli,36,10,27,3.6,0.75
t3_eegp3k,eegp3k,2019-12,Let’s take this further,[deleted],Unflaired/Unknown,18,5,16,3.6,0.889
t3_nhkei1,nhkei1,2021-05,Genetic Distance between Levantine Samples from Multiple Eras and Modern Near Eastern and Mediterranean Populations UPDATED,drgoddammit,Diaspora Lebanese,18,5,14,3.6,0.778
t3_1mejzum,1mejzum,2025-08,"Honestly, after October 7 I don’t want Hammas or Gazans any near me",Efficient_Wallaby144,Unflaired/Unknown,61,17,49,3.588,0.803
t3_14ebwmv,14ebwmv,2023-06,How do you feel about the Israeli-Iranian tensions?,SoleySaul,Israeli,43,12,34,3.583,0.791
t3_1kxe85q,1kxe85q,2025-05,"Indonesia president: We're willing to recognize Israel if it recognizes a Palestinian state, we must guarantee Israel's rights and safety",WebFar9897,Unflaired/Unknown,43,12,38,3.583,0.884
t3_179umvy,179umvy,2023-10,Little hope for us,SAFIziad1,Unflaired/Unknown,68,19,56,3.579,0.824
t3_1ox5zjh,1ox5zjh,2025-11,I cannot say something,pornchavo,Unflaired/Unknown,75,21,63,3.571,0.84
t3_1nww016,1nww016,2025-10,Should we pretend this doesn't exist?,orangecyanide,Unflaired/Unknown,50,14,40,3.571,0.8
t3_euw46w,euw46w,2020-01,The Holocaust,gettling,Lebanese,25,7,19,3.571,0.76
t3_1edk5n7,1edk5n7,2024-07,Multiple casualties reported after rocket impact in Golan’s Majdal Shams,Tagglit2022,Israeli,171,48,149,3.562,0.871
t3_1hx7r4s,1hx7r4s,2025-01,Israel is hinting that they will not withdraw from Lebanon,InitialLiving6956,Unflaired/Unknown,114,32,98,3.562,0.86
t3_gstv9b,gstv9b,2020-05,It sometimes feels like most or at least a lot of people on this sub have no peace or friendship in mind,[deleted],Unflaired/Unknown,78,22,68,3.545,0.872
t3_157dz3t,157dz3t,2023-07,rule of law in Lebanon,Shachar2like,Unflaired/Unknown,39,11,34,3.545,0.872
t3_1jbojhw,1jbojhw,2025-03,I wonder what language the non-arabic speakers were speaking; the foreign fighters involved in killing Alawites. Any guesses?,CriticalJellyfish207,Unflaired/Unknown,39,11,34,3.545,0.872
t3_1q9forh,1q9forh,2026-01,"Would Israel ever accept 200,000 Palestinains from Lebanon into West Bank/Gaza or is it out of the question?",TieNo8188,Unflaired/Unknown,46,13,35,3.538,0.761
t3_1l1eoqp,1l1eoqp,2025-06,Why are aid workers and doctors saying 31 people were killed and hundreds injured yesterday while Israel is denying anything even happened?,WebFar9897,Unflaired/Unknown,53,15,46,3.533,0.868
t3_1g23ll0,1g23ll0,2024-10,This war is terrifying,Current-Meal9360,Lebanese,112,32,94,3.5,0.839
