link_id,post_id,month,title,post_author,post_flair,comments,unique_authors,reply_comments,comments_per_author,reply_ratio
t3_ew5qt3,ew5qt3,2020-01,How many of you ( Israelis) are anti Zionist ?,Ringslap,Lebanese,56,16,43,3.5,0.768
t3_1az1ztw,1az1ztw,2024-02,Rank List! (Israelis only),Substantial-Pen-6984,Unflaired/Unknown,35,10,30,3.5,0.857
t3_1rlkfu2,1rlkfu2,2026-03,whats happening to thr south of Lebanon and South Beirut is Forced Migration in Preparation for Annexation,orangecyanide,Unflaired/Unknown,35,10,30,3.5,0.857
t3_koxs5l,koxs5l,2021-01,Likud Party has introduced a bill to the Israeli Knesset that would prevent Palestinians in Israel from electing people they want elected. Likud wants to choose the people the Palestinians can vote for. This is not democracy.,[deleted],Unflaired/Unknown,28,8,24,3.5,0.857
t3_1fgbrkd,1fgbrkd,2024-09,I would like to vent         if it’s OK could I vent here? I’m feeling upset and I’m having a bad day. ,Prince-RomeIreland23,Unflaired/Unknown,21,6,16,3.5,0.762
t3_1abco6e,1abco6e,2024-01,Hebrew Article,lushman88,Unflaired/Unknown,14,4,13,3.5,0.929
t3_1ml84we,1ml84we,2025-08,"This is what the pager attack did to innocent civilians, while everyone here justified them.",Plane-Translator-176,Unflaired/Unknown,14,4,11,3.5,0.786
t3_is1gbd,is1gbd,2020-09,StandWithUs Condemns Hiring of Saeb Erekat by Harvard University,[deleted],Unflaired/Unknown,7,2,5,3.5,0.714
t3_ixmyol,ixmyol,2020-09,Hadag Nahash - Hine Ani Ba (Here I Come),t-vishni,Diaspora Israeli,7,2,5,3.5,0.714
t3_1fozkr0,1fozkr0,2024-09,I am from the Dahye ask me anything(The one the IDF is attacking in Lebanon),AnybodyGlittering743,Unflaired/Unknown,87,25,71,3.48,0.816
t3_ufx4iw,ufx4iw,2022-05,The state of the Lebanon subreddit:,AetheralAscalon-Ar,Diaspora Lebanese,73,21,65,3.476,0.89
t3_1ayha89,1ayha89,2024-02,no one wants a “bromance” with baby killing psychopathic settlers.,Substantial-Pen-6984,Unflaired/Unknown,135,39,109,3.462,0.807
t3_1fgyrz6,1fgyrz6,2024-09,Remembering the greatest Lebanese president: Bachir Gemayel,levnon14,Diaspora Lebanese,45,13,36,3.462,0.8
t3_okw0sa,okw0sa,2021-07,"Dear Lebanese, how does the crises in your country affects you personally?",MoonAmunet,Unflaired/Unknown,31,9,27,3.444,0.871
t3_1aox0na,1aox0na,2024-02,Please Speak Up Against the Rafah Assault,sacablush,Unflaired/Unknown,96,28,80,3.429,0.833
t3_1gio7bi,1gio7bi,2024-11,Hezbollah 'imposed this on us': Christian-Druze town in Lebanon fights terrorist takeover,Serious_Journalist14,Unflaired/Unknown,48,14,44,3.429,0.917
t3_ecag9i,ecag9i,2019-12,What are some common myths and misconceptions about Lebanese you’ve witnessed among Israelis?,[deleted],Unflaired/Unknown,24,7,21,3.429,0.875
t3_1n7mep4,1n7mep4,2025-09,where would palestinians be sent to when they don't have positive reputation?,Odd_Recognition6934,Unflaired/Unknown,24,7,20,3.429,0.833
t3_1dmb0qn,1dmb0qn,2024-06,What will happen to Palestinian refugees in Lebanon in a Israel Lebanon Peace treaty?,AssociationLive1827,Unflaired/Unknown,106,31,92,3.419,0.868
t3_18lpd8r,18lpd8r,2023-12,What's the Hebrew name of Beirut?,victoryismind,Lebanese,75,22,64,3.409,0.853
t3_1fue7kt,1fue7kt,2024-10,For people who think Israel “wants” Lebanon and Hezbollah is defending Lebanon from Israeli offense,Mobile-Field-5684,Unflaired/Unknown,68,20,58,3.4,0.853
t3_1esmvbb,1esmvbb,2024-08,Hello,IceRepresentative906,Unflaired/Unknown,51,15,43,3.4,0.843
t3_1ftzq3e,1ftzq3e,2024-10,We need peace more than ever :( ,Current-Meal9360,Unflaired/Unknown,51,15,40,3.4,0.784
t3_1ipom8i,1ipom8i,2025-02,Perspective on the “withdrawal”?,mr2600,Diaspora Lebanese,51,15,43,3.4,0.843
t3_1p6ozzd,1p6ozzd,2025-11,Two Haredi Jews visit Lebanon via Syria,pornchavo,Unflaired/Unknown,51,15,44,3.4,0.863
t3_1nvmqu5,1nvmqu5,2025-10,my position on what netanyahu said about greater israel,Fly-almighty945,Unflaired/Unknown,34,10,30,3.4,0.882
t3_f1dg43,f1dg43,2020-02,Nadim Koteich Suggests that it is strategic to make peace with Israel.,gettling,Lebanese,17,5,13,3.4,0.765
t3_1f0cwl5,1f0cwl5,2024-08,Great trio for those who loves the Oud. Link of my favorite song from them in the comments ,SHV007,Israeli,17,5,13,3.4,0.765
t3_ffw49p,ffw49p,2020-03,Struggling with my opinion on Israel,KublaiKhan421,Lebanese,54,16,45,3.375,0.833
t3_evn81j,evn81j,2020-01,Interesting genetic map,[deleted],Unflaired/Unknown,27,8,21,3.375,0.778
t3_hc58k6,hc58k6,2020-06,"New to this sub, anyone want a discussion?",[deleted],Unflaired/Unknown,27,8,20,3.375,0.741
t3_nv5odb,nv5odb,2021-06,Where do I go to follow news on Lebanon?,Shachar2like,Unflaired/Unknown,27,8,23,3.375,0.852
t3_1rp8xx6,1rp8xx6,2026-03,Lebanon Officiqlly Calls for Direct Negotiations With Israel - Thought?,orangecyanide,Unflaired/Unknown,91,27,78,3.37,0.857
t3_1eebg9v,1eebg9v,2024-07,Hezballah too cowardly to admit their mistake,levnon14,Diaspora Lebanese,64,19,59,3.368,0.922
t3_1djj49z,1djj49z,2024-06,What’s the Wildest Claim You’ve Heard About “The Other Side”?,mr2600,Unflaired/Unknown,101,30,82,3.367,0.812
t3_hc9jnl,hc9jnl,2020-06,Repost: discussion,[deleted],Unflaired/Unknown,37,11,31,3.364,0.838
t3_19b6nwh,19b6nwh,2024-01,What blows my mind is that Lebanese and Israelis both have a similar electronic music scene. There is some Psytrance there and there is lots of techno.,Antique-Ad-2618,Unflaired/Unknown,37,11,30,3.364,0.811
t3_ozwlwh,ozwlwh,2021-08,Would Israelis be down for peace with Palestinians and the Lebanese?,HRT-713,Non-Canaanite,131,39,107,3.359,0.817
t3_1goceix,1goceix,2024-11,lurked too far and ended up here,Weekly-Space3770,Unflaired/Unknown,97,29,72,3.345,0.742
t3_15juokn,15juokn,2023-08,Palestinian refugees in Lebanon,Levnon,Lebanese,90,27,78,3.333,0.867
t3_1mps83z,1mps83z,2025-08,Help unvandalize our wplace mural!,Mainstream_millo,Israeli,70,21,57,3.333,0.814
t3_1gr17i1,1gr17i1,2024-11,Israel plans Lebanon cease-fire as gift for Trump,OkBuyer1271,Unflaired/Unknown,60,18,52,3.333,0.867
t3_18k8vct,18k8vct,2023-12,What Is Lebanon's Future?,Substantial-Read-555,Unflaired/Unknown,50,15,40,3.333,0.8
t3_gxqw87,gxqw87,2020-06,The bipolarity of Lebanon and its multiculturalism.,boomchakalakawoowoo,Lebanese,40,12,36,3.333,0.9
t3_nstxjz,nstxjz,2021-06,How bad is the economic crisis in Lebanon?,liorgor,Unflaired/Unknown,40,12,34,3.333,0.85
t3_1az1o88,1az1o88,2024-02,Any Cuban brothers and sisters here? 🙏🏻,Substantial-Pen-6984,Unflaired/Unknown,40,12,33,3.333,0.825
t3_1cea2oy,1cea2oy,2024-04,Hezbollah and Lebanon,Historical-Life-4718,Unflaired/Unknown,40,12,36,3.333,0.9
t3_1en82ox,1en82ox,2024-08,Lebanese identity ,Putrid-Distance-1475,Unflaired/Unknown,40,12,34,3.333,0.85
t3_rryxi5,rryxi5,2021-12,[deleted by user],[deleted],Unflaired/Unknown,20,6,17,3.333,0.85
t3_1qcp0cy,1qcp0cy,2026-01,Why Jordan Remains Israel’s Most Reliable Eastern Frontier,usernameless36,Unflaired/Unknown,20,6,16,3.333,0.8
t3_i4fo9k,i4fo9k,2020-08,"Is it just me or Is r/lebanon locking down every post from an Israeli redditor?! Anyway, I hope you find this donation link helpful 🙏🏻",juh316,Unflaired/Unknown,10,3,8,3.333,0.8
t3_1hdk16w,1hdk16w,2024-12,I am Syrian. AMA. Also sharing some thoughts.,OmarHamami,Unflaired/Unknown,203,61,156,3.328,0.768
t3_188bwfy,188bwfy,2023-12,Will we ever get peace?,AdeptGarden9057,Israeli,53,16,42,3.312,0.792
t3_1aq1tvq,1aq1tvq,2024-02,South Lebanon is proof that Israel doesn't target civilians,FitikWasTaken,Israeli,53,16,47,3.312,0.887
t3_1n6yq8c,1n6yq8c,2025-09,I'm a sunni Syrian muslim. AMA,Patient-Street-4681,Syrian,53,16,40,3.312,0.755
t3_1kz24n7,1kz24n7,2025-05,"WSJ: Israeli intel is helping Lebanon disarm Hezbollah in the South, Salam says 80% of objectives met so far",Histrix-,Israeli,33,10,29,3.3,0.879
t3_l5jpfy,l5jpfy,2021-01,War is coming,[deleted],Unflaired/Unknown,23,7,19,3.286,0.826
t3_1fjpyzd,1fjpyzd,2024-09,"Lebanese here, safe, I don’t want this war, I’m tired of the hate from both sides",Bombastic-side-eye0,Unflaired/Unknown,82,25,69,3.28,0.841
t3_l0zi9e,l0zi9e,2021-01,To the lebanese people of this subreddit... have you ever experienced racism within leftist spaces?,[deleted],Unflaired/Unknown,36,11,30,3.273,0.833
t3_1dzjbju,1dzjbju,2024-07,Anyone here support this brazen murder?,Accomplished-Work445,Unflaired/Unknown,49,15,35,3.267,0.714
t3_1d1vvb0,1d1vvb0,2024-05,Why are so many people pro-war in this sub?,JellyfishHot1635,Unflaired/Unknown,91,28,75,3.25,0.824
t3_l4p7s5,l4p7s5,2021-01,What is your favorite weird Mediterranean food combination??,[deleted],Unflaired/Unknown,52,16,40,3.25,0.769
t3_1fx4r9n,1fx4r9n,2024-10,Is everyone okay,shwel_batata0,Unflaired/Unknown,52,16,47,3.25,0.904
t3_1fpalmi,1fpalmi,2024-09,Heads up.,Israelidru,Israeli,39,12,33,3.25,0.846
t3_1cyu4a8,1cyu4a8,2024-05,"When the rocket sirens start up in my little town near the Lebanon border, I turn to this playlist to help me through it",Big-Editor2093,Unflaired/Unknown,13,4,10,3.25,0.769
t3_17wlp5g,17wlp5g,2023-11,This Subreddit is Disgusting and you Should all be Ashamed of Yourself.,Chadrab,Unflaired/Unknown,55,17,40,3.235,0.727
t3_mu5ysy,mu5ysy,2021-04,Cheesy question but,[deleted],Unflaired/Unknown,42,13,37,3.231,0.881
t3_1fy6if3,1fy6if3,2024-10,Major Hezbollah arms depot targeted in southern Beirut,cha3bghachim,Lebanese,42,13,37,3.231,0.881
t3_1pxpndq,1pxpndq,2025-12,"Lebanese Journalist Tony Boulous: ""Time to Abolish the Palestinian Cause – Israel Can Be Lebanon’s Greatest Ally""",NotSoSaneExile,Israeli,29,9,24,3.222,0.828
t3_1guu3s9,1guu3s9,2024-11,After another siren in the Center of Israel I've been wondering,Tagglit2022,Israeli,74,23,64,3.217,0.865
t3_1etzoc7,1etzoc7,2024-08,Israeli Declaration of Independence ,Zealousideal_Hurry97,Unflaired/Unknown,45,14,40,3.214,0.889
